{
  "$schema": "./schemas/stable-release.schema.json",
  "schemaVersion": 1,
  "version": "0.7.5",
  "releaseTag": "v0.7.5",
  "previousTag": "v0.7.4",
  "status": "qualified",
  "candidateTag": "v0.7.5-prealpha.2",
  "candidateSourceCommit": "98b101ed8b2459cf6d635a7390ed6f10faae75ed",
  "candidateArchiveSha256": "06e76965c559b6bdf1b96539c65083dda6a03f5db08957ac4e445dc454a71a53",
  "runtimeByteComparison": "passed",
  "evidence": {
    "debian": "passed",
    "macos": "passed",
    "windows": "passed",
    "android": "passed",
    "androidPush": "passed",
    "deviceCloud": "passed",
    "ompPublication": "passed",
    "provenance": "passed",
    "secretSinks": "passed"
  },
  "approvedAt": "2026-10-08T10:40:17.842Z"
}
